{
  "facts": {
    "skills": [
      {
        "name": "Java",
        "importance": "REQUIRED",
        "evidenceIds": [
          "e1"
        ]
      }
    ],
    "experienceClauses": [],
    "qualifications": []
  },
  "interpretations": {
    "roleFamily": null,
    "seniority": null,
    "responsibilities": [],
    "technicalConcepts": []
  },
  "evidence": [
    {
      "id": "e1",
      "source": "DESCRIPTION",
      "quote": "Must have Java."
    }
  ],
  "uncertainties": []
}
